{
  "id": "volta1.4.3",
  "band": "volta1",
  "stufe": 4,
  "kapitel": 1,
  "titel_key": "exp_4_3_titel",
  "dauer_min": 10,
  "zerstoerend": false,
  "bauteile_frei": [
    "widerstand",
    "fotowiderstand",
    "transistor_npn",
    "led_rot",
    "leitung"
  ],
  "frage_key": "exp_4_3_frage",
  "vermutungen": [
    "exp_4_3_v1",
    "exp_4_3_v2",
    "exp_4_3_v3"
  ],
  "beobachtungen": [
    "exp_4_3_b1",
    "exp_4_3_b2",
    "exp_4_3_b3"
  ],
  "vermutung_passt": [
    0
  ],
  "vermutung_offen": [
    2
  ],
  "vorlage": {
    "pult": "bedienpult_1",
    "bauteile": [
      {
        "id": "R1",
        "typ": "widerstand",
        "felder": [
          "B1",
          "B2"
        ],
        "wert": 47000
      },
      {
        "id": "LDR1",
        "typ": "fotowiderstand",
        "felder": [
          "B2",
          "C2"
        ]
      },
      {
        "id": "T1",
        "typ": "transistor_npn",
        "felder": {
          "b": "B4",
          "c": "B5",
          "e": "C4",
          "e2": "C5"
        }
      },
      {
        "id": "R2",
        "typ": "widerstand",
        "felder": [
          "A6",
          "A7"
        ],
        "wert": 470
      },
      {
        "id": "D1",
        "typ": "led_rot",
        "felder": {
          "anode": "A7",
          "kathode": "B7"
        }
      }
    ],
    "module": [],
    "leitungen": [
      {
        "von": "P:+9V",
        "nach": "B1",
        "farbe": "rot"
      },
      {
        "von": "C2",
        "nach": "P:0V",
        "farbe": "schwarz"
      },
      {
        "von": "B2",
        "nach": "B4",
        "farbe": "gelb"
      },
      {
        "von": "C4",
        "nach": "P:0V",
        "farbe": "schwarz"
      },
      {
        "von": "P:+9V",
        "nach": "A6",
        "farbe": "rot"
      },
      {
        "von": "B7",
        "nach": "B5",
        "farbe": "blau"
      }
    ],
    "anzeigen": [],
    "pult_stellung": {
      "raumlicht": "dunkel"
    }
  },
  "schritte": [
    "exp_4_3_s1",
    "exp_4_3_s2",
    "exp_4_3_s3"
  ],
  "erfolg": {
    "alle": [
      {
        "bauteil": "D1",
        "groesse": "strom_mA",
        "min": 8,
        "dauer_s": 1
      },
      {
        "bauteil": "D1",
        "zustand": "intakt"
      }
    ]
  },
  "hilfen": [
    "exp_4_3_h1",
    "exp_4_3_h2",
    "exp_4_3_loesung"
  ],
  "erklaerung_key": "exp_4_3_erklaerung",
  "mehr_wissen_key": "exp_4_3_mehr",
  "weiterforschen": [
    "exp_4_3_w1"
  ],
  "jetzt_in_echt_key": "exp_4_3_echt"
}
