{
  "id": "volta1.2.7",
  "band": "volta1",
  "stufe": 2,
  "kapitel": 1,
  "titel_key": "exp_2_7_titel",
  "dauer_min": 10,
  "zerstoerend": false,
  "bauteile_frei": [
    "diode_si",
    "gluehlampe",
    "leitung"
  ],
  "frage_key": "exp_2_7_frage",
  "vermutungen": [
    "exp_2_7_v1",
    "exp_2_7_v2",
    "exp_2_7_v3"
  ],
  "beobachtungen": [
    "exp_2_7_b1",
    "exp_2_7_b2",
    "exp_2_7_b3"
  ],
  "vermutung_passt": [
    0
  ],
  "vermutung_offen": [
    2
  ],
  "vorlage": {
    "pult": "bedienpult_1",
    "bauteile": [
      {
        "id": "D1",
        "typ": "diode_si",
        "felder": {
          "anode": "B2",
          "kathode": "B3"
        }
      },
      {
        "id": "L1",
        "typ": "gluehlampe",
        "felder": [
          "B3",
          "B4"
        ],
        "wert": 10
      }
    ],
    "module": [],
    "leitungen": [
      {
        "von": "P:+9V",
        "nach": "B2",
        "farbe": "rot"
      },
      {
        "von": "B4",
        "nach": "P:0V",
        "farbe": "schwarz"
      }
    ],
    "anzeigen": []
  },
  "schritte": [
    "exp_2_7_s1",
    "exp_2_7_s2",
    "exp_2_7_s3"
  ],
  "erfolg": {
    "alle": [
      {
        "bauteil": "L1",
        "groesse": "helligkeit",
        "min": 0.4,
        "dauer_s": 2
      },
      {
        "bauteil": "L1",
        "zustand": "intakt"
      }
    ]
  },
  "hilfen": [
    "exp_2_7_h1",
    "exp_2_7_h2",
    "exp_2_7_loesung"
  ],
  "erklaerung_key": "exp_2_7_erklaerung",
  "mehr_wissen_key": "exp_2_7_mehr",
  "weiterforschen": [
    "exp_2_7_w1"
  ],
  "jetzt_in_echt_key": "exp_2_7_echt"
}
