{
  "id": "volta1.3.12",
  "band": "volta1",
  "stufe": 3,
  "kapitel": 1,
  "titel_key": "exp_3_12_titel",
  "dauer_min": 10,
  "zerstoerend": false,
  "bauteile_frei": [
    "widerstand",
    "elko",
    "leitung"
  ],
  "frage_key": "exp_3_12_frage",
  "vermutungen": [
    "exp_3_12_v1",
    "exp_3_12_v2",
    "exp_3_12_v3"
  ],
  "beobachtungen": [
    "exp_3_12_b1",
    "exp_3_12_b2",
    "exp_3_12_b3"
  ],
  "vermutung_passt": [
    1
  ],
  "vermutung_offen": [
    2
  ],
  "vorlage": {
    "pult": "bedienpult_1",
    "bauteile": [
      {
        "id": "R1",
        "typ": "widerstand",
        "felder": [
          "B3",
          "B4"
        ],
        "wert": 10000
      },
      {
        "id": "C1",
        "typ": "elko",
        "felder": {
          "plus": "B4",
          "minus": "C4"
        }
      }
    ],
    "module": [],
    "leitungen": [
      {
        "von": "P:+9V",
        "nach": "B3",
        "farbe": "rot"
      },
      {
        "von": "C4",
        "nach": "P:0V",
        "farbe": "schwarz"
      }
    ],
    "anzeigen": []
  },
  "schritte": [
    "exp_3_12_s1",
    "exp_3_12_s2",
    "exp_3_12_s3"
  ],
  "erfolg": {
    "alle": [
      {
        "feld": "B4",
        "groesse": "spannung_V",
        "min": 8,
        "dauer_s": 0.5
      },
      {
        "bauteil": "C1",
        "zustand": "intakt"
      }
    ]
  },
  "hilfen": [
    "exp_3_12_h1",
    "exp_3_12_h2",
    "exp_3_12_loesung"
  ],
  "erklaerung_key": "exp_3_12_erklaerung",
  "mehr_wissen_key": "exp_3_12_mehr",
  "weiterforschen": [
    "exp_3_12_w1"
  ],
  "jetzt_in_echt_key": "exp_3_12_echt"
}
