{
  "id": "volta1.3.9",
  "band": "volta1",
  "stufe": 3,
  "kapitel": 1,
  "titel_key": "exp_3_9_titel",
  "dauer_min": 10,
  "zerstoerend": false,
  "bauteile_frei": [
    "fotowiderstand",
    "leitung"
  ],
  "frage_key": "exp_3_9_frage",
  "vermutungen": [
    "exp_3_9_v1",
    "exp_3_9_v2",
    "exp_3_9_v3"
  ],
  "beobachtungen": [
    "exp_3_9_b1",
    "exp_3_9_b2",
    "exp_3_9_b3"
  ],
  "vermutung_passt": [
    0
  ],
  "vermutung_offen": [
    2
  ],
  "vorlage": {
    "pult": "bedienpult_1",
    "bauteile": [
      {
        "id": "LDR1",
        "typ": "fotowiderstand",
        "felder": [
          "A1",
          "A3"
        ]
      }
    ],
    "module": [],
    "leitungen": [
      {
        "von": "A1",
        "nach": "MESS:VOHM",
        "farbe": "rot"
      },
      {
        "von": "MESS:COM",
        "nach": "A3",
        "farbe": "schwarz"
      }
    ],
    "anzeigen": [],
    "pult_stellung": {
      "messart": "Ohm",
      "raumlicht": "dunkel"
    }
  },
  "schritte": [
    "exp_3_9_s1",
    "exp_3_9_s2",
    "exp_3_9_s3"
  ],
  "erfolg": {
    "alle": [
      {
        "bauteil": "MESS",
        "groesse": "anzeige",
        "zwischen": [
          40000,
          2000000
        ],
        "dauer_s": 1
      }
    ]
  },
  "hilfen": [
    "exp_3_9_h1",
    "exp_3_9_h2",
    "exp_3_9_loesung"
  ],
  "erklaerung_key": "exp_3_9_erklaerung",
  "mehr_wissen_key": "exp_3_9_mehr",
  "weiterforschen": [
    "exp_3_9_w1"
  ],
  "jetzt_in_echt_key": "exp_3_9_echt"
}
