{
  "id": "volta1.3.7",
  "band": "volta1",
  "stufe": 3,
  "kapitel": 1,
  "titel_key": "exp_3_7_titel",
  "dauer_min": 10,
  "zerstoerend": false,
  "bauteile_frei": [
    "leitung"
  ],
  "frage_key": "exp_3_7_frage",
  "vermutungen": [
    "exp_3_7_v1",
    "exp_3_7_v2",
    "exp_3_7_v3"
  ],
  "beobachtungen": [
    "exp_3_7_b1",
    "exp_3_7_b2",
    "exp_3_7_b3"
  ],
  "vermutung_passt": [
    0
  ],
  "vermutung_offen": [
    2
  ],
  "vorlage": {
    "pult": "bedienpult_1",
    "bauteile": [],
    "module": [],
    "leitungen": [
      {
        "von": "P:+9V",
        "nach": "P:P1a",
        "farbe": "rot"
      },
      {
        "von": "P:P1b",
        "nach": "P:0V",
        "farbe": "schwarz"
      },
      {
        "von": "P:P1s",
        "nach": "MESS:VOHM",
        "farbe": "gelb"
      },
      {
        "von": "MESS:COM",
        "nach": "P:0V",
        "farbe": "schwarz"
      }
    ],
    "anzeigen": [],
    "pult_stellung": {
      "messart": "V",
      "p1": 0.667
    }
  },
  "schritte": [
    "exp_3_7_s1",
    "exp_3_7_s2",
    "exp_3_7_s3"
  ],
  "erfolg": {
    "alle": [
      {
        "bauteil": "MESS",
        "groesse": "anzeige",
        "zwischen": [
          2.7,
          3.3
        ],
        "dauer_s": 1
      }
    ]
  },
  "hilfen": [
    "exp_3_7_h1",
    "exp_3_7_h2",
    "exp_3_7_loesung"
  ],
  "erklaerung_key": "exp_3_7_erklaerung",
  "mehr_wissen_key": "exp_3_7_mehr",
  "weiterforschen": [
    "exp_3_7_w1"
  ],
  "jetzt_in_echt_key": "exp_3_7_echt"
}
