{
  "id": "volta1.3.5",
  "band": "volta1",
  "stufe": 3,
  "kapitel": 1,
  "titel_key": "exp_3_5_titel",
  "dauer_min": 10,
  "zerstoerend": false,
  "bauteile_frei": [
    "widerstand",
    "leitung"
  ],
  "frage_key": "exp_3_5_frage",
  "vermutungen": [
    "exp_3_5_v1",
    "exp_3_5_v2",
    "exp_3_5_v3"
  ],
  "beobachtungen": [
    "exp_3_5_b1",
    "exp_3_5_b2",
    "exp_3_5_b3"
  ],
  "vermutung_passt": [
    0
  ],
  "vermutung_offen": [
    2
  ],
  "vorlage": {
    "pult": "bedienpult_1",
    "bauteile": [
      {
        "id": "R1",
        "typ": "widerstand",
        "felder": [
          "A1",
          "A2"
        ],
        "wert": 1000
      }
    ],
    "module": [],
    "leitungen": [
      {
        "von": "A1",
        "nach": "MESS:VOHM",
        "farbe": "rot"
      },
      {
        "von": "MESS:COM",
        "nach": "A2",
        "farbe": "schwarz"
      }
    ],
    "anzeigen": [],
    "pult_stellung": {
      "messart": "Ohm"
    }
  },
  "schritte": [
    "exp_3_5_s1",
    "exp_3_5_s2",
    "exp_3_5_s3"
  ],
  "erfolg": {
    "alle": [
      {
        "bauteil": "MESS",
        "groesse": "anzeige",
        "zwischen": [
          950,
          1050
        ],
        "dauer_s": 1
      }
    ]
  },
  "hilfen": [
    "exp_3_5_h1",
    "exp_3_5_h2",
    "exp_3_5_loesung"
  ],
  "erklaerung_key": "exp_3_5_erklaerung",
  "mehr_wissen_key": "exp_3_5_mehr",
  "weiterforschen": [
    "exp_3_5_w1"
  ],
  "jetzt_in_echt_key": "exp_3_5_echt"
}
