{
  "id": "volta1.3.3",
  "band": "volta1",
  "stufe": 3,
  "kapitel": 1,
  "titel_key": "exp_3_3_titel",
  "dauer_min": 10,
  "zerstoerend": false,
  "bauteile_frei": [
    "widerstand",
    "led_rot",
    "leitung"
  ],
  "frage_key": "exp_3_3_frage",
  "vermutungen": [
    "exp_3_3_v1",
    "exp_3_3_v2",
    "exp_3_3_v3"
  ],
  "beobachtungen": [
    "exp_3_3_b1",
    "exp_3_3_b2",
    "exp_3_3_b3"
  ],
  "vermutung_passt": [
    0
  ],
  "vermutung_offen": [
    2
  ],
  "vorlage": {
    "pult": "bedienpult_1",
    "bauteile": [
      {
        "id": "R1",
        "typ": "widerstand",
        "felder": [
          "B3",
          "B4"
        ],
        "wert": 470
      },
      {
        "id": "D1",
        "typ": "led_rot",
        "felder": {
          "anode": "B4",
          "kathode": "C4"
        }
      }
    ],
    "module": [],
    "leitungen": [
      {
        "von": "P:+9V",
        "nach": "B3",
        "farbe": "rot"
      },
      {
        "von": "C4",
        "nach": "MESS:A",
        "farbe": "blau"
      },
      {
        "von": "MESS:COM",
        "nach": "P:0V",
        "farbe": "schwarz"
      }
    ],
    "anzeigen": [],
    "pult_stellung": {
      "messart": "A"
    }
  },
  "schritte": [
    "exp_3_3_s1",
    "exp_3_3_s2",
    "exp_3_3_s3"
  ],
  "erfolg": {
    "alle": [
      {
        "bauteil": "MESS",
        "groesse": "anzeige",
        "zwischen": [
          0.012,
          0.017
        ],
        "dauer_s": 1
      },
      {
        "bauteil": "D1",
        "zustand": "intakt"
      }
    ]
  },
  "hilfen": [
    "exp_3_3_h1",
    "exp_3_3_h2",
    "exp_3_3_loesung"
  ],
  "erklaerung_key": "exp_3_3_erklaerung",
  "mehr_wissen_key": "exp_3_3_mehr",
  "weiterforschen": [
    "exp_3_3_w1"
  ],
  "jetzt_in_echt_key": "exp_3_3_echt"
}
