{
  "id": "volta1.4.4",
  "band": "volta1",
  "stufe": 4,
  "kapitel": 1,
  "titel_key": "exp_4_4_titel",
  "dauer_min": 10,
  "zerstoerend": false,
  "bauteile_frei": [
    "widerstand",
    "fotowiderstand",
    "transistor_npn",
    "led_gruen",
    "leitung"
  ],
  "frage_key": "exp_4_4_frage",
  "vermutungen": [
    "exp_4_4_v1",
    "exp_4_4_v2",
    "exp_4_4_v3"
  ],
  "beobachtungen": [
    "exp_4_4_b1",
    "exp_4_4_b2",
    "exp_4_4_b3"
  ],
  "vermutung_passt": [
    0
  ],
  "vermutung_offen": [
    2
  ],
  "vorlage": {
    "pult": "bedienpult_1",
    "bauteile": [
      {
        "id": "LDR1",
        "typ": "fotowiderstand",
        "felder": [
          "B1",
          "B3"
        ]
      },
      {
        "id": "R1",
        "typ": "widerstand",
        "felder": [
          "B3",
          "C3"
        ],
        "wert": 4700
      },
      {
        "id": "R3",
        "typ": "widerstand",
        "felder": [
          "B4",
          "B5"
        ],
        "wert": 1000
      },
      {
        "id": "T1",
        "typ": "transistor_npn",
        "felder": {
          "b": "B5",
          "c": "B6",
          "e": "C5",
          "e2": "C6"
        }
      },
      {
        "id": "R2",
        "typ": "widerstand",
        "felder": [
          "A7",
          "A8"
        ],
        "wert": 470
      },
      {
        "id": "D1",
        "typ": "led_gruen",
        "felder": {
          "anode": "A8",
          "kathode": "B8"
        }
      }
    ],
    "module": [],
    "leitungen": [
      {
        "von": "P:+9V",
        "nach": "B1",
        "farbe": "rot"
      },
      {
        "von": "C3",
        "nach": "P:0V",
        "farbe": "schwarz"
      },
      {
        "von": "B3",
        "nach": "B4",
        "farbe": "gelb"
      },
      {
        "von": "C5",
        "nach": "P:0V",
        "farbe": "schwarz"
      },
      {
        "von": "P:+9V",
        "nach": "A7",
        "farbe": "rot"
      },
      {
        "von": "B8",
        "nach": "B6",
        "farbe": "blau"
      }
    ],
    "anzeigen": [],
    "pult_stellung": {
      "raumlicht": "dunkel"
    },
    "werkzeuge": [
      {
        "typ": "taschenlampe",
        "feld": "B2"
      }
    ]
  },
  "schritte": [
    "exp_4_4_s1",
    "exp_4_4_s2",
    "exp_4_4_s3"
  ],
  "erfolg": {
    "alle": [
      {
        "bauteil": "D1",
        "groesse": "strom_mA",
        "min": 8,
        "dauer_s": 1
      },
      {
        "bauteil": "D1",
        "zustand": "intakt"
      }
    ]
  },
  "hilfen": [
    "exp_4_4_h1",
    "exp_4_4_h2",
    "exp_4_4_loesung"
  ],
  "erklaerung_key": "exp_4_4_erklaerung",
  "mehr_wissen_key": "exp_4_4_mehr",
  "weiterforschen": [
    "exp_4_4_w1"
  ],
  "jetzt_in_echt_key": "exp_4_4_echt"
}
