{
  "id": "volta1.1.10",
  "band": "volta1",
  "stufe": 1,
  "kapitel": 1,
  "titel_key": "exp_1_10_titel",
  "dauer_min": 10,
  "zerstoerend": false,
  "bauteile_frei": [
    "gluehlampe",
    "motor",
    "leitung"
  ],
  "frage_key": "exp_1_10_frage",
  "vermutungen": [
    "exp_1_10_v1",
    "exp_1_10_v2",
    "exp_1_10_v3"
  ],
  "beobachtungen": [
    "exp_1_10_b1",
    "exp_1_10_b2",
    "exp_1_10_b3"
  ],
  "vermutung_passt": [
    1
  ],
  "vermutung_offen": [
    2
  ],
  "vorlage": {
    "pult": "bedienpult_1",
    "bauteile": [
      {
        "id": "L1",
        "typ": "gluehlampe",
        "felder": [
          "A1",
          "A2"
        ],
        "wert": 10
      },
      {
        "id": "M1",
        "typ": "motor",
        "felder": [
          "A2",
          "A4"
        ]
      }
    ],
    "module": [],
    "leitungen": [
      {
        "von": "P:+9V",
        "nach": "A1",
        "farbe": "rot"
      },
      {
        "von": "A4",
        "nach": "P:0V",
        "farbe": "schwarz"
      }
    ],
    "anzeigen": []
  },
  "schritte": [
    "exp_1_10_s1",
    "exp_1_10_s2",
    "exp_1_10_s3"
  ],
  "erfolg": {
    "alle": [
      {
        "bauteil": "M1",
        "groesse": "drehzahl",
        "min": 1000,
        "dauer_s": 1
      },
      {
        "bauteil": "M1",
        "zustand": "intakt"
      },
      {
        "bauteil": "L1",
        "zustand": "intakt"
      }
    ]
  },
  "hilfen": [
    "exp_1_10_h1",
    "exp_1_10_h2",
    "exp_1_10_loesung"
  ],
  "erklaerung_key": "exp_1_10_erklaerung",
  "mehr_wissen_key": "exp_1_10_mehr",
  "weiterforschen": [
    "exp_1_10_w1"
  ],
  "jetzt_in_echt_key": "exp_1_10_echt"
}
