{
  "id": "volta1.2.12",
  "band": "volta1",
  "stufe": 2,
  "kapitel": 1,
  "titel_key": "exp_2_12_titel",
  "dauer_min": 10,
  "zerstoerend": false,
  "bauteile_frei": [
    "led_rot",
    "widerstand",
    "leitung"
  ],
  "frage_key": "exp_2_12_frage",
  "vermutungen": [
    "exp_2_12_v1",
    "exp_2_12_v2",
    "exp_2_12_v3"
  ],
  "beobachtungen": [
    "exp_2_12_b1",
    "exp_2_12_b2",
    "exp_2_12_b3"
  ],
  "vermutung_passt": [
    1
  ],
  "vermutung_offen": [
    2
  ],
  "vorlage": {
    "pult": "bedienpult_1",
    "bauteile": [
      {
        "id": "R1",
        "typ": "widerstand",
        "felder": [
          "B3",
          "B4"
        ],
        "wert": 1000
      },
      {
        "id": "D1",
        "typ": "led_rot",
        "felder": {
          "anode": "B4",
          "kathode": "C4"
        }
      }
    ],
    "module": [],
    "leitungen": [
      {
        "von": "P:+9V",
        "nach": "B3",
        "farbe": "rot"
      },
      {
        "von": "C4",
        "nach": "P:0V",
        "farbe": "schwarz"
      }
    ],
    "anzeigen": []
  },
  "schritte": [
    "exp_2_12_s1",
    "exp_2_12_s2"
  ],
  "erfolg": {
    "alle": [
      {
        "bauteil": "D1",
        "groesse": "strom_mA",
        "zwischen": [
          4,
          9
        ],
        "dauer_s": 1
      },
      {
        "bauteil": "D1",
        "zustand": "intakt"
      }
    ]
  },
  "hilfen": [
    "exp_2_12_h1",
    "exp_2_12_h2",
    "exp_2_12_loesung"
  ],
  "erklaerung_key": "exp_2_12_erklaerung",
  "mehr_wissen_key": "exp_2_12_mehr",
  "weiterforschen": [
    "exp_2_12_w1"
  ],
  "jetzt_in_echt_key": "exp_2_12_echt"
}
