{
  "id": "volta1.2.19",
  "band": "volta1",
  "stufe": 2,
  "kapitel": 1,
  "titel_key": "exp_2_19_titel",
  "dauer_min": 10,
  "zerstoerend": false,
  "bauteile_frei": [
    "widerstand",
    "led_rot",
    "led_gruen",
    "leitung"
  ],
  "frage_key": "exp_2_19_frage",
  "vermutungen": [
    "exp_2_19_v1",
    "exp_2_19_v2",
    "exp_2_19_v3"
  ],
  "beobachtungen": [
    "exp_2_19_b1",
    "exp_2_19_b2",
    "exp_2_19_b3"
  ],
  "vermutung_passt": [
    0
  ],
  "vermutung_offen": [
    2
  ],
  "vorlage": {
    "pult": "bedienpult_1",
    "bauteile": [
      {
        "id": "R1",
        "typ": "widerstand",
        "felder": [
          "B3",
          "B4"
        ],
        "wert": 470
      },
      {
        "id": "D1",
        "typ": "led_rot",
        "felder": {
          "anode": "B4",
          "kathode": "C4"
        }
      },
      {
        "id": "D2",
        "typ": "led_gruen",
        "felder": {
          "anode": "C4",
          "kathode": "D4"
        }
      }
    ],
    "module": [],
    "leitungen": [
      {
        "von": "P:+9V",
        "nach": "B3",
        "farbe": "rot"
      },
      {
        "von": "D4",
        "nach": "P:0V",
        "farbe": "schwarz"
      }
    ],
    "anzeigen": []
  },
  "schritte": [
    "exp_2_19_s1",
    "exp_2_19_s2",
    "exp_2_19_s3"
  ],
  "erfolg": {
    "alle": [
      {
        "bauteil": "D1",
        "groesse": "strom_mA",
        "zwischen": [
          5,
          20
        ],
        "dauer_s": 1
      },
      {
        "bauteil": "D2",
        "groesse": "strom_mA",
        "zwischen": [
          5,
          20
        ],
        "dauer_s": 1
      },
      {
        "bauteil": "D1",
        "zustand": "intakt"
      },
      {
        "bauteil": "D2",
        "zustand": "intakt"
      }
    ]
  },
  "hilfen": [
    "exp_2_19_h1",
    "exp_2_19_h2",
    "exp_2_19_loesung"
  ],
  "erklaerung_key": "exp_2_19_erklaerung",
  "mehr_wissen_key": "exp_2_19_mehr",
  "weiterforschen": [
    "exp_2_19_w1"
  ],
  "jetzt_in_echt_key": "exp_2_19_echt"
}
