{
  "id": "volta1.1.7",
  "band": "volta1",
  "stufe": 1,
  "kapitel": 1,
  "titel_key": "exp_1_7_titel",
  "dauer_min": 6,
  "zerstoerend": false,
  "bauteile_frei": [
    "gluehlampe",
    "leitung"
  ],
  "frage_key": "exp_1_7_frage",
  "vermutungen": [
    "exp_1_7_v1",
    "exp_1_7_v2",
    "exp_1_7_v3"
  ],
  "beobachtungen": [
    "exp_1_7_b1",
    "exp_1_7_b2",
    "exp_1_7_b3"
  ],
  "vermutung_passt": [
    0
  ],
  "vermutung_offen": [
    2
  ],
  "vorlage": {
    "pult": "bedienpult_1",
    "pult_stellung": {
      "batterie_V": 4.5,
      "schalter": true
    },
    "bauteile": [
      {
        "id": "L1",
        "typ": "gluehlampe",
        "felder": [
          "B1",
          "B2"
        ]
      }
    ],
    "module": [],
    "leitungen": [
      {
        "von": "P:+9V",
        "nach": "P:S1",
        "farbe": "rot"
      },
      {
        "von": "P:S2",
        "nach": "B1",
        "farbe": "rot"
      },
      {
        "von": "B2",
        "nach": "P:0V",
        "farbe": "schwarz"
      }
    ],
    "anzeigen": []
  },
  "schritte": [
    "exp_1_7_s1",
    "exp_1_7_s2",
    "exp_1_7_s3"
  ],
  "erfolg": {
    "alle": [
      {
        "bauteil": "L1",
        "groesse": "helligkeit",
        "min": 0.2,
        "dauer_s": 2
      },
      {
        "bauteil": "L1",
        "zustand": "intakt"
      }
    ]
  },
  "hilfen": [
    "exp_1_7_h1",
    "exp_1_7_h2",
    "exp_1_7_loesung"
  ],
  "erklaerung_key": "exp_1_7_erklaerung",
  "mehr_wissen_key": "exp_1_7_mehr",
  "weiterforschen": [
    "exp_1_7_w1"
  ],
  "jetzt_in_echt_key": "exp_1_7_echt"
}
