{
  "id": "volta1.3.1",
  "band": "volta1",
  "stufe": 3,
  "kapitel": 1,
  "titel_key": "exp_3_1_titel",
  "dauer_min": 10,
  "zerstoerend": false,
  "bauteile_frei": [
    "leitung"
  ],
  "frage_key": "exp_3_1_frage",
  "vermutungen": [
    "exp_3_1_v1",
    "exp_3_1_v2",
    "exp_3_1_v3"
  ],
  "beobachtungen": [
    "exp_3_1_b1",
    "exp_3_1_b2",
    "exp_3_1_b3"
  ],
  "vermutung_passt": [
    0
  ],
  "vermutung_offen": [
    2
  ],
  "vorlage": {
    "pult": "bedienpult_1",
    "bauteile": [],
    "module": [],
    "leitungen": [
      {
        "von": "P:+9V",
        "nach": "MESS:VOHM",
        "farbe": "rot"
      },
      {
        "von": "MESS:COM",
        "nach": "P:0V",
        "farbe": "schwarz"
      }
    ],
    "anzeigen": [],
    "pult_stellung": {
      "messart": "V"
    }
  },
  "schritte": [
    "exp_3_1_s1",
    "exp_3_1_s2",
    "exp_3_1_s3"
  ],
  "erfolg": {
    "alle": [
      {
        "bauteil": "MESS",
        "groesse": "anzeige",
        "zwischen": [
          8.5,
          9.2
        ],
        "dauer_s": 1
      }
    ]
  },
  "hilfen": [
    "exp_3_1_h1",
    "exp_3_1_h2",
    "exp_3_1_loesung"
  ],
  "erklaerung_key": "exp_3_1_erklaerung",
  "mehr_wissen_key": "exp_3_1_mehr",
  "weiterforschen": [
    "exp_3_1_w1"
  ],
  "jetzt_in_echt_key": "exp_3_1_echt"
}
