{
  "id": "volta1.2.6",
  "band": "volta1",
  "stufe": 2,
  "kapitel": 1,
  "titel_key": "exp_2_6_titel",
  "dauer_min": 12,
  "zerstoerend": false,
  "bauteile_frei": [
    "wechselschalter",
    "gluehlampe",
    "leitung"
  ],
  "frage_key": "exp_2_6_frage",
  "vermutungen": [
    "exp_2_6_v1",
    "exp_2_6_v2",
    "exp_2_6_v3"
  ],
  "beobachtungen": [
    "exp_2_6_b1",
    "exp_2_6_b2",
    "exp_2_6_b3"
  ],
  "vermutung_passt": [
    0
  ],
  "vermutung_offen": [
    2
  ],
  "vorlage": {
    "pult": "bedienpult_1",
    "pult_stellung": {
      "batterie_V": 4.5
    },
    "bauteile": [
      {
        "id": "W1",
        "typ": "wechselschalter",
        "felder": {
          "a": "A1",
          "mitte": "A2",
          "b": "A3"
        }
      },
      {
        "id": "W2",
        "typ": "wechselschalter",
        "felder": {
          "a": "C1",
          "mitte": "C2",
          "b": "C3"
        }
      },
      {
        "id": "L1",
        "typ": "gluehlampe",
        "felder": [
          "C5",
          "C6"
        ]
      }
    ],
    "module": [],
    "leitungen": [
      {
        "von": "P:+9V",
        "nach": "A2",
        "farbe": "rot"
      },
      {
        "von": "A1",
        "nach": "C1",
        "farbe": "blau"
      },
      {
        "von": "A3",
        "nach": "C3",
        "farbe": "gelb"
      },
      {
        "von": "C2",
        "nach": "C5",
        "farbe": "rot"
      },
      {
        "von": "C6",
        "nach": "P:0V",
        "farbe": "schwarz"
      }
    ],
    "anzeigen": []
  },
  "schritte": [
    "exp_2_6_s1",
    "exp_2_6_s2",
    "exp_2_6_s3"
  ],
  "erfolg": {
    "alle": [
      {
        "bauteil": "L1",
        "groesse": "helligkeit",
        "min": 0.2,
        "dauer_s": 1
      },
      {
        "bauteil": "L1",
        "zustand": "intakt"
      }
    ]
  },
  "hilfen": [
    "exp_2_6_h1",
    "exp_2_6_h2",
    "exp_2_6_loesung"
  ],
  "erklaerung_key": "exp_2_6_erklaerung",
  "mehr_wissen_key": "exp_2_6_mehr",
  "weiterforschen": [
    "exp_2_6_w1"
  ],
  "jetzt_in_echt_key": "exp_2_6_echt"
}
